{
  "schema": "agent-compaction-pricing/v1",
  "model": "gpt-5.6-luna",
  "input_usd_per_million": 0.20,
  "cached_input_usd_per_million": 0.02,
  "output_usd_per_million": 1.20,
  "maximum_billable_input_tokens_per_request": 16000,
  "output_token_limit_per_request": 1024,
  "service_tier": "default",
  "revision": "standard tier rates as printed on 2026-10-07; unchanged from the 2026-08-02 retrieval used by the primary live studies",
  "source_url": "https://developers.openai.com/api/docs/pricing",
  "retrieved_at": "2026-10-07T00:00:00Z"
}
